user_input,retrieved_contexts,response,reference,faithfulness,answer_relevancy,context_precision,context_recall
What is the C4C program?,"[' used for other graduate level courses of study.\n…\n\nThis form is used to reprocess a student for a Cal Grant, Chafee Grant, or Middle Class Scholarship using the correct financial aid application, Free Application for Federal Student Aid (FAFSA) or California Dream Act Application (CADAA).\n\nApplication Conversion Form\n\nThe California Student Aid Commission (CSAC) requires you to certify your eligibility for Student with Dependents in\nWebGrants 4 Students\nto receive additional funding.\xa0 If you do not certify your eligibility, it will adversely impact your ability to be considered for additional funding to help you pay your college expenses.\xa0If you are unable to certify your eligibility through WebGrants 4 Students due to a technological issu…', ' mission is to promote educational equity by making postsecondary education affordable for all Californians. CSAC is also responsible for the administration of the\nCalifornia Dream Act Application (CADAA)\n, which determines eligibility for\nstate financial aid, including Cal Grant and the Middle Class Scholarship.\n\nWhat is financial aid?\n\nFinancial aid includes grants, scholarships, work-study, and/or loans provided to students to help pay for tuition, books, rent, food, and transportation while they are enrolled in a college or career certificate program.\nStudents can apply for many forms of financial aid by submitting a\nFree Application for Federal Student Aid (FAFSA)\nor\nCalifornia Dream Act Application (CADAA)\n.\n\nWhat is a mixed status family?\n\nYou are in a mixed status family if:\n\n• You are a U.S. citizen or eligible noncitizen AND\n• Your parent(s) or spouse (FAFSA contributors) do not have a Social Security number (SSN)\n\nWho can apply for financial aid by completing CADAA?\n\nThousands of undocumented students in California apply for and receive state and institutional financial aid every year.\nIn the 2026-27 financial aid cycle, any of the following students who meet the requirements for a “non-resident tuition exemption', 'CADAA FOR MIXED-STATUS FAMILIES\n\nYOUR SAFETY AND PRIVACY IS CSAC’S PRIORITY\nWe understand your concerns about sharing personal data. Any information you provide on a CA Dream Act Application (CADAA) is only used to determine eligibility for state financial aid\n. Your information is not shared with the federal government or used for immigration enforcement.\nRead more about how CSAC protects student data.\n\nIf you have parents or a spouse who does not have a Social Security number (non-SSN FAFSA contributor), you may be facing a difficult decision about applying for financial aid this year.\nWe want you to know that in California, CSAC and many partners are working to provide state-protected ways for you to still apply for financial aid and enroll in college.\n\nWho is CSAC?\n\nThe California Student Aid Commission (CSAC) is the state agency responsible for administering financial aid programs for the State of California.\nOur mission is to promote educational equity by making postsecondary education affordable for all Californians. CSAC is also responsible for the administration of the\nCalifornia Dream Act Application (CADAA)\n, which determines eligibility for\nstate financial aid, including Cal Grant and the Middle Class Scholarship.\n\nWhat is financial aid?\n\n', 'UNDOCUMENTED STUDENTS\n\nWelcome to your ultimate guide to navigating higher education as an undocumented student in California!\nWe know this journey can feel overwhelming, but the California Student Aid Commission (CSAC) offers the best financial aid opportunities for undocumented students in the nation, and we’re prepared to help you every step of the way!\nTogether, we’ll navigate the resources and support systems designed just for you.\n\nYOUR SAFETY AND PRIVACY IS CSAC’S PRIORITY\nWe understand your concerns about sharing personal information and applying for government aid. Please know that any information you provide on a CA Dream Act Application (CADAA) is only used to determine eligibility for state financial aid\n. Your information is never shared with the federal government or used for immigration enforcement.\nRead more about how CSAC protects undocumented student data.\n\nEducation isn’t just a dream-- it’s a real opportunity and investment in your future!\n\nUndocumented individuals in California who graduate college or complete a trade or certification program can significantly increase their earning potential compared to those with only a high school diploma.\nCSAC helps thousands of undocumented students every year, and we’re excited to guide you on your path to success too!\n\nSometimes it helps to hear from others who have been through similar obstacles.\n', ' standards are ineligible for Cal Grant payment and will not use eligibility during the terms they are ineligible for payment.\nMore questions?\nCal Grant FAQ\n\nThe Cal Grant Community College Entitlement Award is for students attending a California Community College (CCC). Applicants must submit a FAFSA or CA Dream Act Application, plus a verified Cal Grant GPA to the California Student Aid Commission by September 2.\n\nWHO IS CONSIDERED FOR A COMMUNITY COLLEGE ENTITLEMENT AWARD\n\n• Students must be enrolled at a California Community College\n• Students who meet the general Cal Grant eligibility requirements, which can be found…\nThe Cal Grant High School Entitlement Award is for current high school seniors and recent high school graduates. Applicants must submit a high school GPA, FASFA or CADAA to the California Student Aid Commission by March 2nd.\n\nWHO IS CONSIDERED FOR A HIGH SCHOOL ENTITLEMENT AWARD\n\n• Current High school seniors and last year’s high school graduates\n• Students who meet the general Cal Grant eligibility requirements\n\nDEADLINE TO APPLY\n\n• Deadl…\nThis grant is for students who plan to transfer directly from a California Community College to a 4-Year University that offers a bachelor degree in the academic year that', "" Questions below!\n\n• Select a Highlighted Date on the calendar\n• Confirm Session Details such as time and language\n• Complete Your Registration via Zoom for free!\n🔵\nBlue\n– Webinars in English ✨\nGold\n– Webinars with Interpreters 🟥\nMagenta\n– Webinars with Office Hours\n\nARE THERE WEBINARS IN SPANISH OR OTHER LANGUAGES?\n\nYes! Some webinars are offered in Spanish, Mandarin, and other languages. Look for gold-highlighted dates on the calendar and check the registration page for details.\nEnglish-speakers are also welcome to join any gold-highlighted sessions!\n\nARE THERE IN-PERSON OPTIONS IF I CAN'T JOIN AN ONLINE WEBINAR?\n\nYes!\nVisit our Cash for College workshop site\nto find in-person workshops near you. CSAC trains and partners with schools and community organizations across California.\n\nWHO ARE THESE WEBINARS FOR? DO I NEED ANYTHING TO JOIN?\n\nOur free webinars are targeted towards high school seniors and college undergraduate students who are applying for financial aid, but everyone is welcome to learn more about the financial aid application process!\nIf you'd like to start or work on your application during the webinar, you may want to have""]","The C4C (Cash for College) program is a series of free webinars offered by the California Student Aid Commission (CSAC). These webinars aim to educate high school seniors and college undergraduate students about the financial aid application process. The webinars are available in various languages, including English, Spanish, and Mandarin. Additionally, some webinars offer office hours for further assistance.","The C4C (California for All College Corps) program provides up to $10,000 for college students who complete community service work.",,0.6871299575018925,,0.0
Who is eligible for the California Dream Act?,"[' upon entering the United States, settled in California, shall be exempt from paying the nonresident tuition fee required by Section 76140 for the length of time he or she lives in this state up to the minimum time necessary to become a resident.”\nCalifornia provides eligible undocumented students, including DACA recipients, with access to state financial aid, scholarships, and educational loans. California\nAssembly Bill (A.B.) 131\n, signed into law in October 2011, provides undocumented students with access to state-based financial aid. California\nAssembly Bill (A.B.) 130\n, signed into law in July 2011, allows undocumented students living in California to access non-state funded scholarships. Both laws are known as the California Dream Act.\n\nCalifornia\nSenate Bill (S.B.) 1210\n, the California DREAM Loan Program, signed into law in September 2014, establishes an educational loan program for eligible undocumented students.\n\nCalifornia extends financial aid to\nboth public and private\npostsecondary institutions.\n\nPlease\nclick here for more detailed information\non eligibility requirements.\n\nCalifornia allows individuals to obtain professional and occupational licensure regardless of their immigration status.\n\nCalifornia\nSenate Bill (S.B.) 1159\n, signed into law in September ', 'The CA Dream Act Application (CADAA) opens on October 1 each year. Get CADAA resources, including the application PDF, at\ncsac.ca.gov/cadaa-resources\n. See how California protects your information at\ncde.ca.gov/nr/el/le/yr22ltr1013.asp\n.\n\nPriority Deadline:\nMarch 2*\n\nSTEP 1: COMPLETE THE CA DREAM ACT APPLICATION TO GET HELP PAYING FOR COLLEGE!\n\nComplete this checklist to ensure that you’ve completed all necessary steps in order to be considered for all state financial aid, including the Cal Grant and Middle-Class Scholarship.\n\n• Understand how you meet AB 540 requirements. Beginning in January 2024, the AB 540 Affidavit is now embedded within the CADAA. The affidavit will be shared directly with all the colleges and universities you listed. It’s helpful to have unofficial transcripts and/or attendance records from all the schools you attended to accurately answer the Affidavit in the CADAA. For your financial aid to be released, you must meet these requirements. U visa holders and students with TPS are also eligible. T visa holders should apply through FAFSA.\n• For your financial aid to be released, you must meet these', "" aid or apply for FAFSA, CSAC created an alternative, the\nCA Dream Act Application (CADAA)!\nThe CADAA opens doors to state and institutional financial aid programs and opportunities\n.\xa0With the CADAA, undocumented students and eligible non-immigrants may qualify for a variety of grants, scholarships, and loans.\n\nLearn more about financial aid programs for undocumented students!\n\nFinding out if you’re eligible may be simpler than you think! The CADAA is for undocumented students in California who don't qualify for FAFSA and plan to attend a college in California.\nHere are the basic requirements:\n\n• You are undocumented (Or have a U-Visa or Temporary Protected Status)\n• You do not qualify for the FAFSA (Not a US citizen or eligible non-citizen )\n• You attended 3+ years of school in California + graduated from a California high school (or equivalent) ( AB 540 )\n• You will be registering or enrolling at a qualifying California college\n• NEW! Students from Mixed-Status Families : U.S. citizens or eligible noncitizens whose parent(s) or spouse are undocumented\n\nAB 540 Nonresident Tuition Exemption\nAB540 exempts undocumented students from paying nonresident tuition ("", ' mission is to promote educational equity by making postsecondary education affordable for all Californians. CSAC is also responsible for the administration of the\nCalifornia Dream Act Application (CADAA)\n, which determines eligibility for\nstate financial aid, including Cal Grant and the Middle Class Scholarship.\n\nWhat is financial aid?\n\nFinancial aid includes grants, scholarships, work-study, and/or loans provided to students to help pay for tuition, books, rent, food, and transportation while they are enrolled in a college or career certificate program.\nStudents can apply for many forms of financial aid by submitting a\nFree Application for Federal Student Aid (FAFSA)\nor\nCalifornia Dream Act Application (CADAA)\n.\n\nWhat is a mixed status family?\n\nYou are in a mixed status family if:\n\n• You are a U.S. citizen or eligible noncitizen AND\n• Your parent(s) or spouse (FAFSA contributors) do not have a Social Security number (SSN)\n\nWho can apply for financial aid by completing CADAA?\n\nThousands of undocumented students in California apply for and receive state and institutional financial aid every year.\nIn the 2026-27 financial aid cycle, any of the following students who meet the requirements for a “non-resident tuition exemption', ' taxes aren’t complete by the priority deadline, March 2* , indicate “Will file” and use estimated household earnings. After your or your parent’s 2024 taxes are filed, log in to update your application.\n• If you are a non-tax filer, indicate “Will not file” and list all untaxed income for the household. Be aware of the IRS filing requirement as a non-tax filer.\n• List all colleges and universities you applied to on the CA Dream Act Application. You can include up to 20 campuses. Be sure to list at least one California college or university to be considered for Cal Grants, which are state-based financial aid.\n• Submit your CA Dream Act Application and review the confirmation page immediately for errors. Complete the application by March 2* , to meet the priority deadline. You can apply after this date, but many grants, such as the Cal Grant and the Middle Class Scholarship, will only consider students who meet the priority deadline. NOTE: Students attending community colleges can apply until September 2.\n• Complete the application by March 2* , to meet the priority deadline. You can apply after this date, but many grants, such as the Cal Grant and the Middle Class Scholarship, will', 'The types of financial aid undocumented students can apply for depends on their residency status. The California Dream Act, which requires students to meet AB 540 eligibility, increases the options of state financial aid. In limited circumstances, Dream Loans and institutional loans are available at CSUs, UC’s, or private schools.']","The California Dream Act is eligible for undocumented students in California who do not qualify for FAFSA (Federal Student Aid), have attended 3+ years of school in California and graduated from a California high school (or equivalent), will be registering or enrolling at a qualifying California college, and meet the requirements for a ""non-resident tuition exemption"". Additionally, students from mixed-status families (U.S. citizens or eligible noncitizens whose parent(s) or spouse are undocumented) are also eligible.","Undocumented students, DACA recipients, U Visa holders, and TPS status holders who meet AB 540 requirements are eligible for the California Dream Act.",,0.9999999999999615,0.9999999999833333,1.0
What financial aid is available for undocumented students?,"['The types of financial aid undocumented students can apply for depends on their residency status. The California Dream Act, which requires students to meet AB 540 eligibility, increases the options of state financial aid. In limited circumstances, Dream Loans and institutional loans are available at CSUs, UC’s, or private schools.', ' for scholarships \nand fellowships on Immigrants Rising’s website, a nonprofit in San Francisco that holistically supports undocumented \nstudents, https://immigrantsrising.org/resources/. The list is organized by scholarships/fellowships for all graduate \nstudents (including those in professional schools) and then by field of study.\nStudents classified as AB 540 are eligible to receive UC state or private funds.\nUCLA Graduate Division, “Graduate Student Financial Support,” https://grad.ucla.edu/asis/stusup/gradsupport.pdf.\nBelow are some great scholarships and fellowships open to DACA recipients:\nUCLA Graduate Fellowships Database (Filter by citizenship status), https://grad.ucla.edu/funding/\nPaul and Daisy Soros Fellowship, http://www.pdsoros.org\nOpen to students pursuing any graduate degree and will finance two years of graduate study; usually due November 1.\nFord Foundation Diversity Fellowship Programs, http://sites.nationalacademies.org/pga/fordfellowships\nDeadlines vary, frequently mid-November.\nFunding Eligibility for UC Graduate Students Who Meet AB 540 and/\nor DACA Criteria\nPrintable version, https://grad.ucla.edu/asis/stusup/ab540dacafundcriteria.pdf', 'from $4,000 to $105,000) in exchange for services in a medically underserved area in California.\n\n18\nUNDOCUMENTED GRADUATE AND PROFESSIONAL STUDENTS HANDBOOK\nHealth Professions Education Foundation, https://oshpd.ca.gov/loans-scholarships-grants/hpef/\nLoan Repayments, Scholarships, and Grants, https://oshpd.ca.gov/loans-scholarships-grants/\nEligible professions include various allied health professions, licensed vocational nurses, those requiring a bachelor’s \nof science in nursing, nurse practitioners, dentists, dental hygienists, certified nurse midwives, physician assistants, \nand physicians.\nCalifornia DREAM Loan Program: The California DREAM Loan Program, authored by Senator Ricardo Lara, allows \nUC and CSU campuses to administer nonfederal loans to undocumented students who meet the California Dream \nAct application requirements. Students who demonstrate financial need can borrow up to $2,000. Interest rates are \nfixed at the same rates as Federal Direct loans, with no fees. You must submit your DREAM application by the March 2 \ndeadline at https://dream.csac.ca.gov/.\nUCLA Financial Aid and', ' open to osteopathic and \nallopathic physicians.\nhttps://oshpd.ca.gov/loans-scholarships-grants/loan-repayment/stlrp/\nInstitutional Loans: Some schools have institutional loans for students. For example, UC San Francisco has created a \nsmall loan for their first undocumented medical student and has indicated that this is an option for other UC medical \nschools.\nUCLA Student Loan Services and Collections, https://www.loans.ucla.edu/\n\n19\nUNDOCUMENTED GRADUATE AND PROFESSIONAL STUDENTS HANDBOOK\nInstitutional Scholarships and Fellowships: Some UC schools have generous scholarships and fellowships open to \nundocumented students. For school-specific scholarships and fellowships, refer to the list in the Immigrants Rising \nGraduate Guide, https://immigrantsrising.org/resource/list-of-graduate-scholarships/.\nJewish Free Loan Association (JFLA): JFLA offers interest-free loans to students of all faiths in the greater Los \nAngeles area. Loans are available for technical, vocational, and trade school undergraduate or graduate education. \nLoan amounts average $3,000, with reduced payments while students are in school and increasing payments', ' departments and the Graduate Division to \ndetermine eligibility for fellowships, training grants, stipends, loans, and work-study funds that pay some graduate \nstudent researcher salaries. The Financial Aid and Scholarships Office determines who is eligible for work-study \nfunding, but it does not create work-study positions. The latter are determined by the student and the hiring academic \ndepartment. Certain off-campus jobs are eligible for work-study funding if the position is a paid one and the company is \na nonprofit, as determined by the Internal Revenue Service.\nGraduate students who have been granted DACA and have obtained a work permit are encouraged to seek financial \nsupport through work appointments and fellowship opportunities off campus.\nGraduate Financial Aid and Scholarships, http://www.financialaid.ucla.edu/Graduate/Overview\nScholarships, Fellowships, and Assistantships\nThere are many scholarships available to undocumented graduate students. Students can search for scholarships \nand fellowships on Immigrants Rising’s website, a nonprofit in San Francisco that holistically supports undocumented \nstudents, https://immigrantsrising.org/resources/. The list is organized by scholarships/fellowships for all graduate \nstudents (including those in professional schools) and then by field of', "" the CSS Profile or their own institutional form.\n\nAM I ELIGIBLE FOR FINANCIAL AID IF I'M UNDOCUMENTED?\n\nUndocumented students aren’t eligible for federal financial aid. Eligibility for state and institutional financial aid will vary based on the state you live in and the colleges you’re applying to. Check with your state to determine if financial aid is available. Before applying to a college, contact their financial aid office to determine their policies regarding institutional financial aid.\nHere are some ways\nto learn more about financial aid eligibility for undocumented students.\n\nIf you’re a U.S. citizen or eligible non-citizen, we suggest you submit the FAFSA to see what financial aid you’re eligible for. You should check with your state and your colleges to see what other applications are required. Whether you need the CSS Profile, institutional forms, or a state financial aid application, make sure to submit them before any deadlines so you can get the financial aid you deserve. By looking into the financial aid policies of your state and your college, you can set yourself up for success in the financial aid process.\n\nRESOURCES TO HELP YOU PAY FOR COLLEGE.\n\nRESOURCES TO HELP YOU PAY FOR COLLEGE.""]","Undocumented students can apply for state financial aid, depending on their residency status. The California Dream Act, which requires students to meet AB 540 eligibility, increases the options of state financial aid. In limited circumstances, Dream Loans and institutional loans are available at CSUs, UC’s, or private schools.

Scholarships and fellowships are also available for undocumented students. Some scholarships and fellowships are listed on Immigrants Rising’s website (<https://immigrantsrising.org/resources/>). Students classified as AB 540 are eligible to receive UC state or private funds. UCLA Graduate Fellowships Database (Filter by citizenship status) is another resource (<https://grad.ucla.edu/funding/>).

Some schools have institutional loans for students. For example, UC San Francisco has created a small loan for their first undocumented medical student and has indicated that this is an option for other UC medical schools.","Undocumented students in California can apply for the California Dream Act (CADAA), Cal Grants, Chafee Grant, Middle Class Scholarship, and institutional scholarships.",,0.843223372442174,,0.4
